{
  "project": "cbia-contentless/ramp-001",
  "stage": "material",
  "inputs": {
    "constraints_snapshot_sha256": "14e288378a6d65bf9fccbdc29fbead6d2f22c67c53aa2909aaebae525178bf4f",
    "ssot_course_sha256": "4104d57f77a79121f591ff839246e7e667ed750041d0096dcec78f4a4dad455c",
    "ssot_references_sha256": "9a8e2915e1c7f0b330c498d9b3a50968f01af10c872a933d3dcb539f56110c74"
  },
  "outputs": {
    "schemas_sha256": "e7dd24f022862531547f5b5a44ea811e6d5c8866473addede7dd8766c98f7a4a",
    "material_sha256": "f4945b0503e831c2e635eb2a1f66883d6b6ab2a83cd7fa6f9c6065d30bfa8520"
  },
  "provenance": {
    "constraints_commit": null,
    "schemas_commit": null,
    "material_commit": null,
    "generated_by": "gpt",
    "generated_on": "2026-01-04"
  },
  "notes": "Imported from ramp01-py legacy layout; normalized to cbia-builder v0.1.0 project structure. Co-05 merged *_1 files; co-06 generated missing THEORY/DRILLS from ssot-input.",
  "references": {}
}
