{
  "project": "cbia-content/inf1250",
  "stage": "material",
  "inputs": {
    "authority": "feuille_de_route",
    "module_map": {
      "M1": {
        "role": "vocabulary_only",
        "assessed": false
      },
      "M2": {
        "assessed": true,
        "tp": "TP1",
        "weight_percent": 15
      },
      "M3": {
        "assessed": true,
        "tp": "TP2",
        "weight_percent": 25
      }
    },
    "deliverables": [
      {
        "id": "M1",
        "kind": "module",
        "assessed": false,
        "role": "vocabulary_only"
      },
      {
        "id": "TP1",
        "kind": "tp",
        "maps_to": [
          "M2"
        ],
        "weight_percent": 15,
        "status": "indexed"
      },
      {
        "id": "TP2",
        "kind": "tp",
        "maps_to": [
          "M3"
        ],
        "weight_percent": 25,
        "status": "planned"
      }
    ]
  },
  "outputs": {
    "material": [
      "cbia-content/inf1250/material/index.md",
      "cbia-content/inf1250/material/tp/tp1/index.md"
    ]
  },
  "provenance": {
    "generated_by": "chatgpt",
    "generated_on": "2026-01-06",
    "material_commit": null,
    "schemas_commit": null,
    "constraints_commit": null
  },
  "notes": "INF1250 project stub + TP1 index scaffold (feuille de route authority).",
  "references": {}
}